,Song,Movie,Singers,Musicians,Lyricists,Year,Lyrics
0,Sip Sip,Arjun Patiala,"Guru Bhullar, Akash D",Akash D,Akash D, ,Gol gol mainu lage Mainu lage duniya saari Hale thodi hai peeti Par peeni bottle saari x (2) Peg neat main bana ke Jager te shot laake Peg neat main bana ke Jager te shot laake Bhul jaani duniyadari Bhul jaani duniyadari Sip sip kar piyunga Par piyunga bottle saari x (4) Mix karke sab peete hain Main peeta hoon neat Saare sad ho chon maithon Mere sir te chadh gayi weed Poori bottle khatam karke Full set main ho jaunga Mujhe ghar nahi jaana Yahin main so jaunga Seal bottle ki khol Saare munh ko laga lo Door door jo baithi hain Unhein paas bulwa loonga Naughty kuchh karne ka Mera mood ab bana hai Jaldi se yeh maan jao Aur kuchh to karwa lo Sip sip kar piyunga x (4) Saturday di night aa Talli ajj ho jao saare Peeke hona full tight aa Bottoms-up kar do saare x (2) Daaru mind te chadha ke Hangover night bana ke Daaru mind te chadha ke Hangover night bana ke Party karni raat main saari Sip sip kar piyunga Par peeyunga bottle saari x (8)
1,Para Para,Judgemental Hai Kya,Arun Dev Yadav,Rachita Arora,Prakhar Varunendra, ,"Tame chu, hoo hoo ha ha Tame chu, hoo hoo ha ha Tame chu, tame chu, tame chu Tuchiya Pa pari pa pa para para Hoo hoo ha ha Pa pari pa pa para pari pa Pari pa pa Bas ek character ya khud hi kahani hai Bhatti ki aanch ya barish ka paani x (2) Cho chamak cho Bigdi jhagdi si ladki Cho chamak cho Khaali bhari si ladki Cho chamak cho Cho cho chamak cho Cho cho chamak cho Bak bak bak bak bolti rehti Dagmag dagmag dolti rehti Bematlab bekhauf baat si Baji barabar wall clock si x (2) Pa pari pa pa para para Pari pa pa Yeh queen shaitani Hoo hoo ha ha Jalti phuljhadi si hai, hey Jaise nasha ho kiya Hoo hoo ha ha Jalti fuljhadi si hai ha Jaise nasha ho kiya Tala na hai zubaan pe Jo chaaha keh diya Tame chu chume ta tuchiya ta tuchiya x (3) Tame chu chume ta tuchiya Bak bak bak bak bolti rehti Dagmag dagmag dolti rehti Bematlab bekhauf baat si Baji barabar wall clock si x (2) Pa pari pa pa para para Pari pa pa Yeh queen shaitani Reality ka ratta maar Raat raat ro leti hai Tedhi tedhi talk hai uski Tongue twist ho leti hai x (2) Tame chu chume ta tuchiya ta tuchiya x (4) Bak bak bak bak bolti rehti Dagmag dagmag dolti rehti Bematlab bekhauf baat si Baji barabar wall clock si x (2) Pa pari pa pa para para Pari pa pa Yeh queen shaitani"
2,Dil Jaaniye,Khandaani Shafakhana,"Jubin Nautiyal, Tulsi Kumar",Payal Dev,Shabbir Ahmed, ,Sachiyan mohabbtan nibhawanga Ranjheyan main tera kehlawanga Ik vaari dil lag jaane de Dil da karaar ban jawanga Sachiyan mohabbatan nibhawangi Heeriye main teri kehlawangi Ik vaari dil lag jaane de Dil da karaar ban jawangi Ilteja dil di hai Ik pehal ishq ki hone de Dil Jaaniye mainu jee lain de Do lafz-e mohabbat keh lain de Dil Jaaniye mainu jee lain de Do lafz-e mohabbat keh lain de Din raat tujhe main dekha karoon Aankhon ki yehi bas chahat hai Din raat tujhe main dekha karoon Aankhon ki yehi bas chahat hai Main kaid hoon teri lakeeron mein Tere sath hi meri kismat hai Jeet ki haar ki Ik pehal pyar ki hone de Dil Jaaniye mainu jee lain de Do lafz-e mohabbat keh lain de Dil Jaaniye mainu jee lain de Do lafz-e mohabbat keh lain de Mera rab tujhmein hi vassda ae Dil karta teri ibaadat hai Mera rab tujhmein hi vassda ae Dil karta teri ibaadat hai Nazdeek hai lekin keh na sake Mujhko teri hi aadat hai Bewajah jeene ki Haule haule se dil khone de Dil Jaaniye mainu jee lain de Do lafz-e mohabbat keh lain de Dil Jaaniye mainu jee lain de Do lafz-e mohabbat keh lain de
3,O Saki Saki,Batla House,"Neha Kakkar, Tulsi Kumar, B Praak",Tanishk Bagchi,-, ,"Main teri aankhon ka saahil Main tere dil ke hi kaabil Tu musafir main teri manzil Ishq ka dariya hai behta Doob ja tujhse hai kehta Haan meri baaho mein aake mil Wo sharabi kya sharabi Dil mein jiske gham na hon Lut gaya samjho sharabi Paas jiske hum na hon O saki saki re, saki saki Aa paas aa reh na jaaye Koyi khwaahish baaki O saki saki re, saki saki Aa paas aa reh na jaaye Koyi khwaahish baaki Tere jaisi mashuka mujhe yaar chahiye Na paisa chahiye na hi karaar chahiye Ye husn ka hai khumaar mera Tujhpe hai chhaaya jo Kurbaan hua mujhpe jo Khushnaseeb bada hai wo Wo sharabi kya sharabi Dil mein jiske gham na hon Lut gaya samjho sharabi Paas jiske hum na hon Saki saki saki O saki saki re, saki saki Aa paas aa reh na jaaye Koyi khwaahish baaki O saki saki re, saki saki Aa paas aa reh na jaaye Koyi khwaahish baaki"
4,Zilla Hilela,Jabariya Jodi,"Raja Hasan, Dev Negi, Pravesh Mallick, Monali Thakur",Tanishk Bagchi,"Shabbir Ahmed, Tanishk Bagchi", ,"Bijli gira de raani Oye cooler chala de raani Hoye bijli gira de raani Cooler chala de raani Aaya hai hero kamaal kar de Band bula le aaja Nachega tera raaja Toll free pe tu call karde Jab kamar teri balkhaye Har dil se nikle haye Jab hile tu bhookamp aavela Eh duyi teen chaar Patna hile Patna hile, Baliya hile Chhapra hilela Ho chhori lachke, aaye haye Gori lachke, oho Teri lachke jab kamariya Saara zilla hilela Ho chhori lachke jab kamariya Saara jila hilela Mera pyar bada hai desi baby Ismein kya achambha Arre roz kare tu disco baby Aaj tu kar le zumba Jab kamar teri balkhaye Har dil se nikle haye Jab hile tu bhookamp aavela Eh duyi teen chaar Kaashi hile Kaashi hile, Mathura hile Jhansi hilela Ho meri lachke, haye haye haye Lachke haye haye Lachke jo kamariya Saara jila hilela Ho chhori lachke jab kamariya Saara zilla hilela"
5,Sachiyan Mohabbatan,Arjun Patiala,Sachet Tandon,Sachin-Jigar,Priya Saraiya, ,"Main jadon teri Khaabon ki gali mein challeya Ho challeya to chal ke main tainu mileya Ho mil gaye, mil gaye tere mere nain Main aashiq tera banneya Main jadon teri Khaabon ki gali mein challeya Ho challeya to chal ke main tainu mileya Ho mil gaye, mil gaye tere mere nain Main aashiq tera banneya ho Dass lain de, mainu dass lain de Dil da jo haal hai woh dass lain de Sachiyan Mohabbatan main tainu karda Tere layi, tere layi jag lad’da Ho mujhse tu hove na, hove na kadi door Itni araj main Rabb se karda Sachiyan Mohabbatan main tainu karda Tere layi, tere layi jag chhad’da Tu ik pal hove na, hove na kadi door Itni araj main Rabb se karda ho Sunn kudiye, chal chaliye Chal chaliye chal chal chaliye Chal challa chaliye Main jadon teri Khaabon ki gali mein challeya Ho challeya to chal ke main tainu mileya Ho mil gaye, mil gaye tere mere nain Main aashiq tera banneya ho Dass lain de, mainu dass lain de Dil da jo haal hai woh dass lain de Ho ajj kehan de mainu keh vi lain de Dil da jo haal hai woh dass lain de"
6,Funk Love,Jhootha Kahin Ka,Yo Yo Honey Singh,Yo Yo Honey Singh,"Yo Yo Honey Singh, Lil Golu", ,"Aaja oh sexy girl mere kol Teri jawaani baby hai anmol Apple bottom tere jaise duniya gol Meri dirty picture ka kar le tu role Machhli Jal ki raani hai Jeevan jiska paani hai Aaj wo machhli kha jaaunga Naam jiska Sunny hai Machhli Jal ki raani hai Jeevan jiska paani hai Aaj wo machhli kha jaaunga Baat toh maine thaani hai Funk love, funk love Funk love, funk love Funk love! Machhli Jal ki raani hai Jeevan jiska paani hai Aaj wo machhli kha jaaunga Naam jiska Sunny hai Machhli Jal ki raani hai Jeevan jiska paani hai Aaj wo machhli kha jaaunga Baat toh maine thaani hai Bas kar tu bas baby Aiven na hass baby Ek saal se tere pichhe Ab tu jaa phass baby Bas kar tu bas baby Aiven na hass baby Tujhko main baahon mein leke Phir doonga kas baby Kash-ma-kash hogi All night long baby Aadimanav hoon main King Kong baby Mujhko samjhe tu aashiq tera You must be wrong baby I don’t give a funky love Tabhi to bana ye song baby Funk love, funk love Funk love, funk love Funk love, funk love Funk love, funk love Funk love! Fudak fudak ke, mudak fudak ke Mudak fudak ke mudak fudak Fudak fudak ke naache tu Hasi ki hai baat Oh silky baalon wali Pehle saude ko sambhal Aaja sauda kar le tu saudagar se Bigda ladka hoon achche ghar se Ishq maine try kiya tha Kuchh bhi hai milta na Waste of time, waste of money Be fizul mein pilta raha Man udaas karke main Taaron ko ginta raha Main to khada raha Par waqt ka ghanta hilta raha Funk love, funk love Funk love, funk love Machhli Jal ki raani hai Jeevan jiska paani hai Aaj wo machhli kha jaaunga Naam jiska Sunny hai Machhli Jal ki raani hai Jeevan jiska paani hai Aaj wo machhli kha jaaunga Baat toh maine thaani hai"
7,Psycho Saiyaan,Saaho,"Sachet Tandon, Dhvani Bhanushali, Tanishk Bagchi",Tanishk Bagchi,Tanishk Bagchi, ,"Tera main, tera main Tera main dum dum dumma x (2) Pehle tu neeli akhiyan ladayi gayi Raaton ki meri needein udayi gayi Nashe mein tere mujhko dubayi gayi Aise mujhe ghoore tu kaye ko, kaye ko Ke jhoothe vaade karke banayi gayi Na jaane kitnon ko rulayi gayi Oh thumkon se dil ko churayi gayi Aaja tujhe leke chalein chai ko, chai ko, Oh saiyaan saiyaan ve Oh sa sa saiyaan ve Na chhod kalaiyan Mod ke bahiyan jaldi se Side ho, side ho Aaya mora saiyaan psycho Aaya mora saiyaan psycho Tera main, tera main Tera main dum dum dumma x (2) Main ladki seedhi saadi si Bottle pee li hai aadhi si x (2) Haan teri yeh jo gravity Mujhe kheenche teri ore Oh saiyaan saiyaan re Main tera sipahiya re Na pakadun kalaiyan, chhodu na Leke aaja tere bhai ko, bhai ko Aaya mora saiyaan psycho Aaya mora saiyaan psycho"
8,The Wakhra Song,Judgemental Hai Kya,"Navv Inder, Lisa Mishra, Raja Kumari",Tanishk Bagchi,"Tanishk Bagchi, Raja Kumari", ,"Ki ae Gucci, Armani Pichhe roldi jawani Check kardi brand’an wale tag ni Aaja dassan tainu sohniye Ni fashion ki hunda Tere yaar da taan wakhra swag ni Ki ae Gucci, Armani Pichhe roldi jawani Roldi ja.. roldi ja.. roldi ja.. Check kardi brand’an wale tag ni Tag ni, tag ni Aaja dassan tainu sohniye Ni fashion ki hunda Tere yaar da taan wakhra swag ni Ho mera suit Patiyala Kitnon ko maar daala Haan Punjab di main kudi sardarni Jutti meri haigi kaim Saare kattdi hai vehm Tere ton vi zyada wakhra swag ni Oh wakhra swag ni Drop it! Chal hat! Always talkin’ money Only hear ch ching Show me how you love me I don’t want your bling Baby badi badi baatein Zyada kar na tu brait I don’t want the Gucci Armani wala tag Tu taan jaandi rakane Sadde pakke ne yaarane Jithe vi main laiyan ni ne yaariyan Gall dil di na kahiye Taiyon door door rahiye Thug hundiyan na surat’an pyariyan Tu vi hai shikaari Poori rakhdi taiyyari 3-4 ghumana hai kuwariyan Gallan kardae tu pyari Dikha ke Ferrari Karda hai jhoothi dildaariyan Oh wakhra swag ni Yo! See you tryna holla Dripin’ trendy products Thinking you’re Raja Baby you better come harder Swag ki main raani Chal photo meri kheench Be my Benz Bentley I’m still way out of your league Ki ae Gucci, Armani Pichhe roldi jawani Check kardi brand’an wale tag ni Aaja dassan tainu sohniye Ni fashion ki hunda Tere yaar da taan wakhra swag ni Haanji! Ho mera suit Patiyala Kitnon ko maar daala Haan Punjab di main kudi sardarni Jutti meri haigi kaim Saare kattdi hai vehm Tere ton vi zyada wakhra swag ni Oh wakhra swag ni Drop it! Swag ni, wakhra swag ni Wakhra swag ni Wakhra swag ni"
9,Shehar Ki Ladki,Khandaani Shafakhana,"Badshah, Tulsi Kumar, Abhijeet, Chandra Dixit",Tanishk Bagchi,Tanishk Bagchi, ,"Ankh mila ke puchhe Hi, how are you? Hi, how are you? Hi, how are you? Hath mila ke puchhe How do you do? How do you do? How do you do? Ankh mila ke puchhe Hi, how are you? Hath mila ke puchhe How do you do? Style pe uski Smile pe uski Haaye tabiyat bhadki Shehar ki ladki Shehar ki, shehar ki Shehar ki, shehar ki ladki x (2) Masti mein ghoome ghoome Ghoome ghoome ha ha ha Baahon mein jhoome jhoome Jhoome jhoome pa pa ra Haaye haaye yeh zaalim figure Teri machalti nazar Mera badan choome choome Choome, choome Ankh mila ke puchhe Hi, how are you? Hath mila ke puchhe How do you do? Style pe uski Smile pe uski Haaye tabiyat bhadki Shehar ki ladki Shehar ki, shehar ki, shehar ki Oh my god! ladki zehar Kaun si city teri, kaun sa shehar Baby hai danger, lagti hai stranger Caffeination of kehar, yes! Ladki hot ni, bohat hi hot hai Aag pakadti hai, ladkon ki maut hai Shot lagaati ae, tappe tu khaati hai Thakti nahi hai, stamina bohat hai Haaye gully gully ghoome Mere aage peeche jhoome Haaye nazar na lag jaaye mujhko Beauty meri hai caffeine ki goli jaisi Nasha na chadh jaaye tujhko Figure pe teri sab marte hain Scan poora tujhe karte hain Lambi lambi sansein bharte hain But touch karne se darte hain Roz tu aake puchhe Hi, how are you? Baal gira ke puchhe How do you do? Mumbai ki barsaat mein jaise Jhoom ke bijli kadki Shehar ki ladki Shehar ki, shehar ki Shehar ki, shehar ki Shehar ki, shehar ki Shehar ki, shehar ki ladki"
10,Khadke Glassy,Jabariya Jodi,"Yo Yo Honey Singh, Ashok Mastie, Jyotica Tangri",Tanishk Bagchi,"Tanishk Bagchi, Channi Rakhala", ,"Thekeyan te nitt khadke ho Thekeyan te nitt khadke Khadke glassi tere naa de Yes! He’s back again From all the way Make you crunk again any another day We can spin your brain into another brain This is Masti with your boy Honey Singh Palkon pe tainu ae bithayi phirde Tattoo tere naam da karayi phirde Aaha! Palkon pe tainu ae bithayi phirde Tattoo tere naam da karayi phirde Mere pichhe lakhan udaayi phirde Photo meri wall pe lagayi phirde Mere pichhe lakhan udaayi phirde Photo meri wall pe lagayi phirde Mundet saare pichhe ghumde Mar na jayein lad-lad ke Thekeyan te nitt khadke Khadke glassi tere naa de x (2) Thekeyan te nitt khadke Khadke glassi mere naa de x (2) Saare bane phirde hain hakdaar ni Jaane kaun karda hai mainu pyar ni Saare bane phirde hain hakdaar ni Jaane kaun karda hai mainu pyar ni Seene vich dil dhadke sohniye Seene vich dil dhadke Vekh vekh tainu bas tadpe Thekeyan te nitt khadke Khadke glassi tere naa de x (2) Yes! He’s back again Make you crunk again We can spin your brain Brake it down like this Tu hai meri, main hoon tera haan keh de Dil kya hai baby meri jaan lele x (2) Mauka ik baari mainu haan dede Ya to tere jaise koyi la dede x (2) Par yeh to mumkin hi nahi sohneya Yeh to mumkin hi nahi Ki meri jaisi koyi mil jaave Thekeyan te nitt khadke Khadke glassi mere naa de x (2) Thekeyan te nitt khadke Khadke glassi tere naa de x (2) Khadke glassi.."
11,Saturday Night,Jhootha Kahin Ka,"Neeraj Shridhar, Jyotica Tangri, Enbee","Amjad Nadeem, Aamir","Amjad Nadeem, Enbee", ,"Volume badha de baby dance karna hai Volume badha de baby dance karna hai Saamne tu aaja romance karna hai Party ke liye main jagah nahi dhoondta Saturday night! Saturday night main apne aap ki nai sunta Saturday night main apne aap ki nai sunta Aap ki kya kisi ke baap ki nai sunta x (2) Battiyan bujha dein chalo ho jaayein shuru Ho jaayein shuru, ho jaayein shuru Ho battiyan bujha dein chalo ho jaayein shuru Aaja chipak jaayein banke glue Chal bomb tu gira de Saare ang tu hila de Teri aakhon ka main pyasa Aaja pyaas bujha de Teri hi wajah se dil Romeo sa jhoomta Saturday night, Saturday night! Saturday night main apne aap ki nai sunta Saturday night main apne aap ki nai sunta Aap ki kya kisi ke baap ki nai sunta x (2) Monday ko hi set kar leti Saturday ka plan Mummy daddy ki na sunti Party karne ki hai fan Jis bhi club mein enter kar deti Laga deti hai jam Laal dress mein kaun hai yeh ladki Itni hottie oh damn Chal hat! Hain famous iske jalve Isko lena na tum halke Jhalke jhalak jhalak jhal jhalke Dekho beat pe kaise chhalke Baby padh leti jo man mein Kehti sabko hoon jogan main Main kehta kar le jo man mein Kyon ki beat chale meri gun pe Saturday night main apne aap ki nai sunta Aap ki kya kisi ke baap ki nai sunta x (2)"
12,Fancy Thumke,Family Of Thakurganj,"Mika Singh, Dev Negi, Jyotica Tangri, Parry G",Sajid-Wajid,Danish Sabri, ,Aasmaan se barse rang Chal aa holi khelein sang x (2) Pichkaari hathon mein le kar Kar do sabki shanti bhang Dhoodh-voodh mein bhaang Mila ke Baith ja bhole nain mila ke x (2) Sharam-varam ki baat chhod ke Naach le baby mere sang Jab tu maare fancy thumke Jab tu maare fancy thumke Dil pe gire bijuriya re Jab rang lagaye Ho jab rang lagaye sawariya re Badi rangeen laage kamariya x (3) Tere hothon ki smile Kar degi mujhko ghayal Baby yeh tera style Ho dil mein preet ke beat bajaaye Jaanu main tera drama Tera yeh saregama Ungli pakadne di thi Tu to sar pe hi aan pada hai Haye baahon pe thumhare Aake simat jayenge Happy Holi keh ke gale lipat jayenge Bheeg ke paani mein aise laage Bheeg ke paani mein aise laage Jaise jal mein chale machhuriya re Jab rang lagaye sawariya re Badi rangeen laage kamariya x (2) Taiyaar ho kya? Aaya main aaya Aur aate hi main chhaya Aate hi hilaya Maine maahaul banaya Kar na tu koyi fikar Kar masti tu nidar Kaahe ko tu door bhaage Aaja mere paas idhar Dhamaka karenge hum Holi ke is tyohar mein Aa jao saare sath mein Hum mil ke jhande gaad dein Aa jao saare sath mein HUm doob jaayein gulaal mein Dekhoge pichkaari Rang denge kurti saari Colour na utrega Chaahe dhobi se wash karana Dekho na aisa karna Mehnga padega warna haan Muthi mein rang le kar Mere gaalon pe rang lagana Haye cute cute face tera Akhiyon pe kajal Kar hi daalega Oh re baby humko paagal Mukh pe ghunghta daal ke rakh Kahin lag na jaaye najariya re Jab rang lagaye sawariya re Badi rangeen laage kamariya x (3)
13,Crazy Habibi Vs Decent Munda,Arjun Patiala,"Guru Randhawa, Benny Dayal",Sachin-Jigar,"Guru Randhawa, Benny Dayal", ,"Habibi, habibi, habibi Saari saari raat kardi aan party aa Raat kardi aan party Saari saari raat kardi aan party aa Saari saari raat kardi aan party aa Lagdi aan kudiyan ve hottie Naughty saari raat kardi aa party aa Lagdi aan kudiyan ve hottie Nale nale mundeyan de tod’di aan dil Decent mundeyan de tod’di aan dil Baby girl lakhan ch banaundi baby bill Baby girl lakhan ch banaundi baby bill Haan baby meri janiya janiya Jaan kad ke gayi Haan baby meri crazy aa, desi aa Mainu lutt ke gayi x (2) [Arabic vocals by Benny Dayal] Sone jaise baal baby ke Lohe jaisa baby ka hai dil Desi jaise dal makhni Beauty goreyan nu kardi aa kill x (2) Haan baby meri janiya Haan baby meri baby aa Decent mundeyan de tod’di aan dil Baby girl lakhan ch banaundi baby bill Haan baby meri janiya janiya Jaan kad ke gayi Haan baby meri crazy aa, desi aa Mainu lutt ke gayi Haan baby meri janiya Haan baby meri baby aa"
14,Basanti No Dance,Super 30,"Prem Areni, Janardan Dhatrak, Divya Kumar, Chaitally Parmar",Ajay Atul,Amitabh Bhattacharya, ,"No no no.. Basanti no dance no no no In front of these dogs no no no x (2) Hey Holi hai bhai holi hai Sabki holi holi hai Teri holi, meri holi Sabki holi happy hai Hey Rnglish kidhar hai English! Holi English Happy bhi English yaar Me kahenga English mein taako Taake nahi sasura Dil Bihari speaking bhaasha Jaane naahi doosra He told me, you told him I told you no tell her I told her no tell you So tell me to tell you She told him to tell her Ye le teri English! Ye gazab duniya ka funda Fikar me not chinta Ghalat English bhale hi We will gaadenge jhanda They throwing inta We throwing rocks They phenking inta You throwing rocks Basanti no dance In front of these dogs no no no x (4) No no no"
15,Nasha Mainu Chadh Gaya,One Day,"Nimisha, Rishi Singh",Rishi Singh,Alaukik Rahi, ,"Mood bada fancy hai Grrove bada dancy hai Nikki nikki chadh gayi mainu Color tera chadh gaya ve Raat mein sardi hai Dil ne hadd kar di hai Nikki nikki chadh gayi mainu Rang tera chadh gaya ve Chadh gaya nasha mainu ishq da Kyun? Chadh gaya, chadh gaya Chadh gaya nasha mainu ishq da Kyun? Chadh gaya, chadh gaya Ve chadh gaya nasha mainu ishq da Nasha mainu chadh gaya Lakk nu hila ke, move it Nikki nikki laake, move it Dil nu chura ke, move it Sohniye ni aaja mere kol Aaja mere kol Tere lakk de hulareyan ne Maar ditta saanu Tere hottie naughty style’an ne Maar ditta saanu Aaja mere kol, mere kol, mere kol Saansein chaldi jaavein Dhadkanein badhdi jaavein Aake ab thaam le mainu Maahiya ve Baatein yeh zaahir meri Tere hi khaatir meri Raatein hain jannat jaisi Jaaniya ve Eyes blush karti Tujhse jab ladti hai Haan nikki nikki chadh gayi mainu Rang tera chadh gaya ve Chadh gaya nasha mainu ishq da Kyun? Chadh gaya, chadh gaya Chadh gaya nasha mainu ishq da Kyun? Chadh gaya, chadh gaya Ve chadh gaya nasha mainu ishq da Nasha mainu chadh gaya"
16,Koka,Khandaani Shafakhana,"Badshah, Dhvani Bhanushali, Jasbir Jassi",Tanishk Bagchi,"Tanishk Bagchi, Mellow D, Badshah", ,"Koka koka, koka koka, koka koka Aur sun’na hai to subscribe karo T-Series Ho dil waali gall kar lai Ho aaja mera hath fad lai Ho aaja mere naal nach lai Kisne tujhko roka Ho kanni diamond jhumke Ho Sona jaise tere thumke Ho gall meri jaayi sunn ke Tujhe rab ne banaya anokha Na tadpa, baby karde tu haan Mera kar de jeena saukha Koka koka, ko ko ko ko Koka, tera kujh kujh kehnda ni Koka, tera kujh kujh kehnda ni Lehanga tera lutt putt lehnga ni Koka Koka, mera kujh kujh kehna ni Koka, mera kujh kujh kehna ni Koka, mera kujh kujh kehna ni koka Haaye ni tera koka koka koka koka koka Floor pe chakkar kaate jaise lattu Baby tu hai totta tere aaju baaju tattu Hilti hai jaise bani ho rubber ki Aaj na rukne wali hai yeh ladki Kyonki! Kaan mein aa ikk baat bataun Dikhta bhi badhiya hoon, achcha kamaoon Tu bole to mommy se kehke Tere mere rishte ki baat chalaoon Hansdi hasandi meri sakhiyan Baaki baatein kare teri akhiyaan Lagta hai tu hai koi cheater Karta hai gall saari jhuthiyan Dil kya hai baby main to jaan vaar doon Nau-lakha tere utte haar vaar doon Loyal rahoonga, tere nakhre sahoonga Ik vaari sanu dede mauka Koka koka, ko ko ko ko Koka, tera kujh kujh kehnda ni Koka, tera kujh kujh kehnda ni Lehanga tera lutt putt lehnga ni Koka Koka, mera kujh kujh kehna ni Koka, mera kujh kujh kehna ni Koka, mera kujh kujh kehna ni koka Haaye ni tera koka koka koka koka koka"
17,Tooh Hila Lo,One Day,"Divya Kumar, Farhad, Tia Bajpai",Joy-Anjan,Alaukik Rahi, ,"Oye saj gaye dekho gully mohalle Jhalar walar saj gaye Saj gaya dulha, saje baraati Dhol nagaade baj gaye Dulhan desi pehan videsi Naachan wali dress mein Dulhe ne smile maari Ghar wale rajh gaye Dulhan ko hai mila jo dekho Cash jewellery car Ho baby ji ki khul gayi lottery Tooh hila lo Ho baby shaadi kar rahi bawali Tooh hila lo Ho dekho kist badi yeh chhaap rahi Tooh hila lo Ho baby kuchh zyada hi maang rahi Tooh hila lo Tere mausa ka attitude by god Jaise koyi afsar hai Mere ghar mein to inke jaise Ji ghoomte 72 hain Tere fufa ji nachein Jitendra ke jaise Par takle hain Tere jijaji ekdum Govinda Magar thoda hakle hain Haaye re bitiya bechari Kaise adjust karegi Saasu ka chehra aisa Ke jaise blast karegi Sasuri ki muchhein dekho Katte ke nok jaisi Poore ghar mein hai chalti Bas inki gundagardi Haan magar tera banna hai awesome Yeh face dekho light maare Bank balance lakhon ka iska Yeh jaane kya karta hai Oye Sonu, oye Monu Oye Rinki, oye Pinki Aaj thumak lo jee bhar ke Baby ki shaadi hai Arre desi pila do neat Desi baja do Aise mahaul mein aadhi bhi Full chadh jaati hai Kaisi jodi hai, badi hi cute hai Dulha dholak hai to baby fruit hai Zara si naughty hai, zara si rude hai Baby laadli ho very good hai Ho baby ji ki khul gayi lottery Tooh hila lo Ho baby shaadi kar rahi bawali Tooh hila lo Ho dekho kist badi yeh chhaap rahi Tooh hila lo Ho baby kuchh zyada hi maang rahi Tooh hila lo Hoye hoye hoye hoye tooh hila lo x (3)"
18,Main Deewana Tera,-,Guru Randhawa,Sachin-Jigar,Guru Randhawa, ,Gore gore mukhde pe kala kala til Teriyan adawan mera lutt leya dil Dil hai mera badi mushkil mein Aake baby mainu kalli kitte mil x (2) Oh meri preeto sunn jeeto Oh meri preeto sunn jeeto Yeh haal jo hai mera haal Aisa hai kyun? Kyun? Kyunki main deewana tera Main deewana tera Main deewana tera o o o Aashiq purana tera Main deewana tera main x (2) Jaane jaana meri jaan-e-man Body teri lage like a diamond One in a million baby girl Dekhu tujhe to mera nikle hai dum x (2) Oh meri preeto sunn jeeto Oh meri preeto sunn jeeto Yeh haal jo hai mera haal Aisa hai kyun? Kyun? Kyunki main deewana tera Main deewana tera Main deewana tera o o o Aashiq purana tera Main deewana tera main x (2)
19,Manmohini,Hume Tumse Pyaar Kitna,"Mika Singh, Kanika Kapoor, Ikka","Raaj Aashoo, DJ Emenes (MIB), Vicky, Hardik",Shabbir Ahmed, ,"Ho beat vajjdi te lakk hilda Ho je tu nachdi te main vi nachda Ho DJ waleya baja de Mika Singh Ho billi akh ton na koyi bachda Ho ajj nachne di raat Kal pe chhod kal ki baat Dil mera jaane kab tera ho liya Manmohiniye ni man moh liya x (4) Manmohini ni man moh liya Tujhe dekha tera tera ho liya Tere husan ke paani mein baby Maine apna munh dho liya aah! Aise tu naache jaise Baag mein naache morni Nazar pehli mein dil le gayi Tu dilon ki chorni Kya tera iraada hai Itna nakhra kyun zyada hai Dekhi maine lakh par dekhi na Tere wargi hor ni Jab beat hai baaje Ladki naache hath utha, kamar hila ke Tujhe pata loon, apni bana loon Romantic gaana gaa ke Ho pyar di flight baby Dil pe mere land kar Dance wali beat pe Kamar thodi band kar x (2) Bawle ja koyi aur girl find kar Bawle ja koyi aur girl find kar Ho ajj nachne di raat Kal pe chhod kal ki baat Dil mera jaane kab tera ho liya Manmohiniye ni man moh liya x (4)"
20,Paisa,Super 30,Vishal Dadlani,Ajay Atul,Amitabh Bhattacharya, ,"Teri zindagi ko Zindagi banane aaya paisa Be-rangi duniya ko Rageen banane aaya paisa Andhere kamron mein Batti jalane aaya paisa Sapne tere sachche karke Dikhane aaya paisa Din tere bhi jeene ka aaya hai Jo chaaha tha toone woh paaya hai Sab paison ki leela hai, maya hai Patjhad ka bhi mausam laa de sawan jaisa Zindagi ko zindagi banane aaya paisa Be-rangi duniya ko Rageen banane aaya paisa Andhere kamron mein Batti jalane aaya paisa Sapne tere sachche karke Dikhane aaya paisa Jo tere shauk hain Shauk se aaj poore kar le sabhi Baaki na reh jaaye kuchh kasar Aage ka tera lamba hai safar Yahaan se nahi dekhega Tu peechhe mudke kabhi Gham tere tu peechhe chhod aaya hai Aur muskurana tujhe aaya hai Sab paison ki leela hai, maya hai 12 ko bhi dekho laage 52 jaisa Tere jeevan ke Chakke ghumane aaya paisa Teri bekaari ke Chhakke chhudane aaya paisa Andhere kamron mein Batti jalane aaya paisa Sapne tere sachche karke Dikhane aaya paisa"
