,Song,Movie,Singers,Musicians,Lyricists,Year,Lyrics
96,Tanha Hua,Zero,"Rahat Fateh Ali Khan, Jyoti Nooran, Altamash Faridi, Shadab Faridi",Ajay-Atul,Irshad Kamil, ,Rabba duhaiyan Roothi parchhaiyan jaane anjane Main baar baar tanha Main roz roz tanha Main beshumar tanha hua x (2) Ankh mein nahi hai dekho Qatra koyi bhi uska haan Auron ka to hona kya tha Apna bhi main na ho sakaa Dil ki gehraiyan Poochhe sachchaiyan jaane anjane Main baar baar tanha Main roz roz tanha Main beshumar tanha hua x (2) Duniya ka mela dekhoon Khudko akela dekhoon Dil albela dekhoon ghamzada x (2) Dekh le ae dil bewafa Chahaton mein karke wafa Yaadon se pa loonga main Apna bana loonga main Jaan gawa loonga main is dafa x (2) Meri aggwaiyan Karti ruswaiyan jaane anjane Main yaar yaar kehna Main yaar yaar kehna Ohde naal naal rehna sada x (2) Main baar baar tanha Main roz roz tanha Main beshumar tanha hua x (4)
97,Heer Badnaam,Zero,Romy,Tanishk Bagchi,Kumaar, ,Ho rang tera ishq hai farzi Ki vekhi teri main taan khudgarzi Tu har din Heer badalda ae Teri bewafai wali daaru mainu chadh gayi Ho Ranjhe jaake tu dass de Rabb nu Ki main taan aake thug lai sab nu Ae haiga ilzam tere te Sunn lai tu aake Heer badnaam karti naam karti Tu jhoothiyan mohabbatan paake x (2) Tu neeyat da khota Ranjhe Baad tere kaun re Main vi yaari jhoothi karni Keh diyan by God ve Main tere pichhe hunn nahio rona Ishq vich baaghi hona Ae haiga ilzam tere te Sunn lai tu aake Heer badnaam karti naam karti Tu jhoothiyan mohabbatan paake x (4)
98,Aala Re Aala,Simmba,"Dev Negi, Goldi",Tanishk Bagchi,Shabbir Ahmed, ,"Aala re aala Simmba aala! Hey Simmba! Machinga machinga dhol abhi bajenga Dhina dhin dhaap dekho aaj raja nachenga Nachenga nachenga aaja raja nachenga Machinga machinga dhol abhi bajenga Dhina dhin dhaap dekho aaj raja nachenga Aaya tera aaya raja Naach mere saath aaja Bhool ke tu baju wali khidki ki Lene aaya, lene aaya Simmba teri firki x (2) Ek dooni do, do dooni chaar Kya kya na nachega sara nachega bazar Teen tikke nau, nau nukke barah Sare mohalle mein sabka hai pyara Aaya tera aaya raja Naach mere saath aaja Bhool ke tu baju wali khidki ki Lene aaya, lene aaya Simmba teri firki x (2) Aala re aala Simmba aala!"
99,Chamma Chamma,Fraud Saiyaan,"Neha Kakkar, Romi, Arun, Ikka",Tanishk Bagchi,Shabbir Ahmed, ,"Chham chham paijaniya Chham chham haye paijaniya Dekha dekhi dil mera jud gaya re Leke pardesi dil udd gaya re Aankhon se connection jud gaya re Leke pardesi dil udd gaya re Tere close aake Teri saason mein samaun raja Tere close aake Teri saason mein samaun raja Teri neendein chura loon Chamma chamma baaje re Meri paijaniya Re chamma chamma baaje re Meri paijaniya x (2) Meri chham chham karti paijaniya Desi beat pe hilti kamriya Us par tiki hai meri nazariya Main hoon pyaasa tu hai dariya Tere gol gol kaan ke jhumke Ek baar to mud jaana meri sunn ke 100 mein se 100 maine diye tere nakhre ko Aag laga di jab maare thumke Hila doon UP Hila doon MP Haye hila doon UP Hila doon MP Jab maarun main thumka haye Tere thumke pe ho Mumbai Patna Main haarun Kalkatta haye Teri patli kamar, teri tirchhi nazar Mujhko tu bana le raani apna lover Meri patli kamar, meri tirchhi nazar Mere aage pichhe ghoome jaane kitne lover Tere hath na aani Chamma chamma baaje re Meri paijaniya Re chamma chamma baaje re Meri paijaniya Ho chamma chamma baaje re Teri paijaniya x (2) Chham chham paijaniya Chham chham haye paijaniya"
100,Tere Bin,Simmba,"Rahat Fateh Ali Khan, Asees Kaur, Tanishk Bagchi",Tanishk Bagchi,Rashmi Virag, ,"Oh re piya main to tere layi Sau raatan jagun Jithe jaave tu Othe jaave dil Dass ki main karun Jo tu russ jaani ae Dil yeh tutt janiye Tere sang sang raah Saari kat jaani ae Main taan tere naal rehna Maan enna mera kehna Meri akhiyon se hona kadi door na Tere bin, tere bin Tere bin nai lagda dil mera dholna Tere bin nai lagda dil mera dholna Sab chadd jayein tu na mainu chhodna Tere bin nai lagda dil mera dholna Nai lagda, nai lgda, nai lagda Ho nai lagda, nai lgda, nai lagda Tere sang sang reh ke Main rang jaaun tere rang Teri neend se khwaab main apna jod loon Tu sath na ho to chaar kadam na chal paaun Teri raah pe raah main apni mod loon Ho jag bhull jaaye mujhe Tum nahi bhoolna Tere sang jeena mera Tere sang dhalna Sacchi chahaton ka hota koyi mol na Tere bin, tere bin Tere bin nai lagda dil mera dholna Ke tere bin nai lagda dil mera dholna Sab chadd jayein tu na mainu chhodna Ke tere bin nai lagda dil mera dholna Jaaniya, haaniya Tu vi seekh kade dukh sukh bolna Tere bin nai lagda dil mera dholna Tere bin nai lagda dil mera dholna Sab chadd jayein tu na mainu chhodna Tere bin nai lagda dil mera dholna"
101,Gali Gali,KGF,Neha Kakkar,Tanishk Bagchi,Rashmi Virag, ,"Maine tere liye chhoda hai zamana Zara tera irada toh bata Aise nazrein tu mujhse chura na Zara tera irada toh bata Chhaya hai mujhpe tera hi nasha Kambakht dil yeh kahan ja phansa Main teri deewani, tu mera deewana Samajh le nazar ka ishara Gali gali mein phirta hai Tu kyun banke banjara Aa mere dil mein bas ja Mere aashik awara Tera kasoor hai na mera kasoor Dono ke dono paas hoke bhi door Teri wajah se main toh soyi nahi Meri wajah se tu bhi jaaga zaroor Meri mohabbat se bach na sakega Samajh jaan-e-mann ueh ishara Gali gali mein phirta hai Tu kyun banke banjara Hey aa mere dil mein bas ja Mere aashik awara "
102,Husn Parcham,Zero,"Bhoomi Trivedi, Raja Kumari",Ajay,Irshad Kamil, ,"Hath mein raat yeh baaki hai Baat na-pak wafa ki hai Sandli si purvai sath hai Ho tu hai naakam mohabbat mein Main jalun pyar ki shiddat mein Dhundhli si ruswayi sath hai Kaam tu aaja mere Soch na yaar savere Chhod doongi main ghar pe Karna hai kyun gham Husn parcham, husn parcham Lehraya yaar dama dum dum x (2) Husn parcham, husn parcham Lehraya yaar dikha dum kham Husn parcham Bang like a drum work my body Aaj raat I’m in-charge So dance to my beat Dhin-tak-dhin do it slowly One night only Cause I’m feeling hot Tequila no chase aa Oh on your lips you like my tewar Aaj raat ko lagega Give me the uh huh imma call you later Hai dil-phenk iradon mein Ab teri swadon mein Kabhi meethi zuban bhi Khaari hoti hai re Tu meri zaroorat hai Yeh meri mohabbat hai Jo tere liye hi jaari hoti hai re Loot ke yaar khazana Laut ke ghar aa jana Aashikon mein ho aashiq Banke sitara tum Husn parcham, husn parcham Lehraya yaar dama dum dum x (2) Husn parcham, husn parcham Lehraya yaar dikha dum kham Husn parcham"
103,Jab Se Mera Dil,Amavas,"Armaan Malik, Palak Muchhal",Sanjeev Darshan,Sandeep Nath, ,Dil ko dil se kuchh hai kehna Dil se ab na door rehna Dil ki bas yehi ghuzarish hai Dhadkanon ko ki sun’ne baatein Jo labon se keh na paate Dil ki bas yehi ghuzarish hai Jab se mera dil tera hua Poochho na mujhko mujhe kya hua Ab teri baahon mein jeena mujhe Warna hai mar jaana Haan shayad yeh pal phir na milein Na khatm hon yeh silsile Ban ke dua tum jo mile Ek zindagi aur jee lein Mere iraadon ne tay kar liya Zarra bhi ab na rahe darmiyan Meri wafaon ki hai yeh adaa Ghar hon judaa ho jaaun fanaa Jab se mera dil tera hua Poochho na mujhko mujhe kya hua Ab teri baahon mein jeena mujhe Warna hai mar jaana
104,Salaam Rocky Bhai,KGF,"Vijay Prakash, Mohan Krishna, Santhosh Venky",Ravi Basrur,Nagendra Prasad, ,"Chalne ka hukum Rukne ka hukum Zindagi pe hukum Maut pe hukum Jaan Bambai ka, jaan Bambai ka Jaan Bambai ka jaane re Iski aankhon mein aankh na daalo Noch leta hai praan ve Aag toofan jab bhi milta hai Aisa barood paida hota hai Aye khuda zara dekho Logon ke dil mein sultan dekho Dushman ho yeh hai shaitan dekho Aye khuda zara roko Rukne wala karta Mudne wala karta Bambai ki galiyan bhi Ghabra ke isko dekhein saala Salaam Rocky bhai Rock Rock Rocky Salaam Rocky bhai Salaam Rocky bhai Salaam Rocky bhai Ilaaka tera bhai Tu hai sabka bhai"
105,Aankh Marey,Simmba,"Neha Kakkar, Mika Singh, Kumar Sanu",Tanishk Bagchi,Shabbir Ahmed, ,"Oh God, one more remix! Ho dil dhadkaaye aur seeti bajaye Haye dil dhadkaye, seeti bajaye Beech sadak pe nakhre dikhaye saare Ho karke ishare ho ladki aan aan aan Ho ladki aan aan aan Ho ladki aankh marey Aankh maare, ho ladki aankh marey Aankh maare, ho ladki aankh marey Jahan jahan jaaun Mere pichhe pichhe aaye Gali gali ke aashiq Donon mera hona chaahein Haye jahan jahan jaaye Tere pichhe pichhe aaye Hum to hain deewane tere Tera hona chaahein Seeti bajaye, nakhre dikhaye Seeti bajaye nakhre dikhaye Beech sadak mein haye naam mera pukare Oh karke ishare Ho ladka aan aan aan Ho ladka aan aan aan Ho ladka aankh marey Aankh maare, ho ladki aankh marey Aankh maare, ho ladki aankh marey Tushar Kapoor ki awaaz mein Cho pon aan aan aan Cho pon aan aan aan Cho pon aan aan aan Kumar Sanu ki aawaz mein Ho ladki aankh marey Aankh maare, ho ladki aankh marey Aankh maare, ho ladki aankh marey Ho ladka aan aan aan Ho ladki aan aan aan Ho ladka aan aan aan"
106,Tension Wali Raat,-,"Neha Kakkar, Farhad Bhiwandiwala",Arko,Arko, ,"Tension wali raat Tension wali raat Man mein ulti seedhi baat Bachaye Ram re Kismat mein hai jhol Usmein dil mein chheda gol Bachaye Ram re Tension wali raat Man mein ulti seedhi baat Bachaye Ram re Phir bhi kabhi jo zara dheere se palte Gusse mein nazron se shararat jo chhalke Tum to giroge baby aise phisal ke Haan, haan ji haan Hum jo kahein to sab bachawan ko aaye Hum pe gire to sawan khud bheeg jaaye Hum jo chalein to yeh zameen dhak-dhakaye Haan, haan ji haan Tension wali raat Hogi aisi hoyi baat Yahan pe yaar ve Phoolegi ab saans Jitni aaungi main paas yaar ve Tension wali raat Man mein ulti seedhi baat Bachaye Ram re Kismat mein hai jhol Usmein dil mein chheda gol Bachaye Ram re Mujhpe na mar main tera wise nahi hoon Tere liye main zyada jayaz nahi hoon Mujhko pata hai teri khwahish main hi hoon Haan, haan ji haan Tension wali raat Man mein ulti seedhi baat Bachaye Ram re Kismat mein hai jhol Usmein dil mein chheda gol Bachaye Ram re"
107,Issaqbaazi,Zero,"Sukhwinder Singh, Divya Kumar",Ajay-Atul,Irshad Kamil, ,"Prem na upje khet mein Bhaiya prem bike na haat re Par jab jab yeh ho jaaye Lag jaati hai vaat re, vaat re Khadi ho jayegi khaat re Madua pee ke prem ka hum Hain tanik bauraye se Re woh mashooka, yaar hum hain Beech na koyi aaye re Ho uske naina neat daru Se ghazab chadh jaaye re Ho tab se hamri woh jab se Jag mein aashiq aaye re Kasam se, dharam se Kasam se jiyara chakna choor hai Issaqbaazi se Kasam se jiyara chakna choor hai Ishqbaazi se Kasam se jiyara chakna choor hai Issaqbaazi se Ho tum ka jaano preet ki chidiya Kaun gagan mein udti hai Preet hamari parchhayi hai Jahan mudein hum mudti hai Ho lag jaibe hai tej katari Badi zor se seene mein Dard bada ho tabahi aave hai Bada maza jeene mein Ho uska hamra mel anokha Uska hamra mel anokha Woh lehar hum paani hain Tum ho paani hum kinara Lehar hum tak aani hai Kasam se, dharam se Kasam se jiyara chakna choor hai Issaqbaazi se Kasam se jiyara chakna choor hai Ishqbaazi se Kasam se jiyara chakna choor hai Issaqbaazi se Hum us-se prem ghazab karte Woh humse prem ghazab karti Woh humre liye zaroori hai Woh humre bina adhoori hai Hum tose usko ladwayenge Itna hum bhadkayenge Tu chamcha ho ja uska chaahe uska Maanegi na baat Ho ek batte do aashiq Tohri kaise hogi chhori re Apne kad se ooncha na tu Sapnon ka charkha kaat Karat hai kyun baatein umar se badi Tu desi deewana woh English pari Re Sahiba padhaku thi Mirza tha tayin Tab bhi to woh English hai desi hoon main Hai jiya le gayi hai re tohri yeh baat Aa karle tu yaari mila humse hath Aa karle tu yaari mila humse hath Dhin-tak dhin-tak dhin-tak dha"
108,Yaar Graribaaz,-,"Dilpreet Dhillon, Karan Aujla, Shree Brar",Desi Crew,Shree Brar, ,"Afghan di ni feem chitt evergreen Akh khadi te hulare aunde lor ch Desi crew.. Afghan di ni feem chitt evergreen Akh khadi te hulare aunde lor ch Sadiyan tayin na biba jaan gaye ni patte Kill laate jehde vailiyan de daur ch Kal vi si end, ajj vi aa kem Lit rehn ge ni jinna chir yaar khade ne Oh gaddiyan te khade ne Vich paye ghade ne Yaar sare tunn ni Graribaaz bade ne x (2) Yaar sare tunn ni Grari baaz bade ne Ho kinniyan kateeda sadde agge agge daudiyan Niyane aan ch hikkan kade kittiyan ni chaudiyan Aise bannde jatt de group ch na bharti Vehde utte chaad pichhon chakk lainde paudiyan Ho gaddi ch facility ae daru naal gun’an di Meri akh vairiyan te mere utte ranna di Age utte jaande jehde kari di kutayi ae Meeting kara diye ni hathan naal kanna di Na hit karde stunt Chote chahida current Aivein hawa ch ni koke layi de Tere jehe kutte bille Bade Chandigarh chhile Putt nit hi ne lamme paayi de Age na jaayi tu record dekh layi Kithon kithon aa langhaunde assi rod dekh layi Check Google te kari kharcha tu week da Pher kaka apna jugaad dekh layi Belong 31 da, shonki jatt gun da American asle license’an utte chadhe ne Oh gaddiyan te khade ne Vich paye ghade ne Yaar sare tunn ni Graribaaz bade ne Oh gaddiyan te khade ne Vich paye ghade ne Yaar sare tunn ni Graribaaz.. Ho rip naal maade pistol dabban ch, Ban’de aa jattan de shingar ni Ho gaddiyan ch aap bad pair dharida ae Pehlan chadhde aan sadde hathyar ni Classic je bande nahio thod caran naaran di Shahar tere boldi ae thukk sardaran di Chori chori sunde baliye star ne Geet kaahde niri agge tere Shree Brar de Ho peen-khaan de shokeen jatt jattiye Gehdi route te launde aa nit mehfilan Dabban vich jode magazine’an de Seat’an thalle nachdiyan barrel’an x (2) Ho kudiyan ni chhed de Khabi-khan dedh de Jattan de ni poore taan asool khare ae Oh gaddiyan te khade ne Vich paye ghade ne Yaar sare tunn ni Graribaaz bade ne x (2)"
109,Muddaton,Mumbai City,Amit Mishra,Shaan Asif Raj,Azeem Shirazi, ,Tujhse bichhad ke bhi main Kahin tujhmein reh gaya x (2) Phir tanha yun hua Ke main khud se bichhad gaya x (2) Muddaton roya karenge tere bin Bas tujhe socha karenge raat din x (2) Tu nahi to zindagi bhi Ajnabi si ho gayi Gham ki chaadar odh kar Har khushi bhi so gayi Ab to bas tanhaiyan Tanhaiyan reh gayi Mere andar aur baahar Ek kami si ho gayi Muddaton roya karenge tere bin Bas tujhe socha karenge raat din x (2) Rooh ki gehraiyon mein Dard ka sailab hai Ishq ka betaab dil Tukde tukde khwaab hain Ab to hain bechainiyan Bechainiyan har kahin Mujhe lagta hai aisa Ab mera koyi nahi Muddaton roya karenge tere bin Bas tujhe socha karenge raat din x (2)
110,Jaan Nisaar,Kedarnath,"Arijit Singh, Asees Kaur",Amit Trivedi,Amitabh Bhattacharya, ,"Na maaregi deewangi meri Na maaregi awargi meri Ke maaregi zyada mujhe maut se Narazgi teri Kyun itna hua hai tu khafa Hai zid kis baat ki teri Ke maaregi zyada mujhe maut se Narazgi teri Jaan nisaar hai, jaan nisaar Tere pyar pe mere yaar Jaan nisaar hai Duniya zamaane se Rishte mitaye hain Tujhse hi yaari hai hamari Ik baar to aa Maine nibhaya hai Karke dikhaya hai Le teri baari Ik vaari tu bhi pyar nibha Tu bhi pyar nibha oh yaara Teri berukhi se hai badi Umar intezar ki meri Ki maaregi zyada mujhe maut se Naraazagi teri Kyun itna huaa hai tu khafa Hai zidd kis baat ki teri Ke maaregi zyada mujhe maut se Narazgi teri Jaan nisaar hai, jaan nisaar Tere pyar pe mere yaar Jaan nisaar hai"
111,Tu Hi Re,2.0,"Armaan Malik, Shashaa Tirupati",A.R. Rahman,Abbas Tyrewala, ,"Hey tu hi re, tu hi re battery hai Saanson ki tu bijili Hey tu hi re, tu hi re battery hai Discharge na hona kabhi Sun to mechanical sundariye Tere hi current se main jaaga priye Dil mein utar gayi data jaise Hey my digital sohniye Chhu loon tere siliconic gaal kabhi Firewall jaise rokein baal kabhi Wifi se duniya ki sair karein Hoon super conductor main Hey tu hi re, tu hi re battery hai Saanson ki tu bijili Hey tu hi re, tu hi re battery hai Discharge na hona kabhi x (2) Sun to mechanical sundariye Tere hi current se main jaaga priye Dil mein utar gayi data jaise Hey my digital sohniye Woh sensor hai jis se jaage ehsaas Woh cable jo ho energy pass Hai disc tu aur hai drive bhi tu Woh software jis se bujhe meri pyaas Tere RAM se CPU dhadke Aa login kar le, tera password de Electromagnetic rishte mein Yeh love shuv kahan se aa gaya Aisa tu aisa shuruwat meri Mega oh mega tu hi aakhiri Love you from zero to infinity Hey tu hi re, tu hi re battery hai Saanson ki tu bijili Hey tu hi re, tu hi re battery hai Discharge na hona kabhi x (2) Sun to mechanical sundariye Tere hi current se main jaaga priye Dil mein utar gayi data jaise Hey my digital sohniye Chhu loon tere siliconic gaal kabhi Firewall jaise rokein baal kabhi Wifi se duniya ki sair karein Hoon super conductor main Hey tu hi re, tu hi re battery hai Saanson ki tu bijili Hey tu hi re, tu hi re battery hai Discharge na hona kabhi x (2)"
112,Mere Naam Tu,Zero,Abhay Jodhpurkar,Ajay-Atul,Irshad Kamil, ,"Woh rang bhi kya rang hai Jo milta na tere honth ke rang se hu-ba-hu Woh khushbu kya khushbu Thehre na jo teri sanwari zulf ke ru-ba-ru Tere aage yeh duniya hai feeki si Mere bin tu na hogi kisi ki bhi Ab yeh zahir sareaam hai, elaan hai Jab tak jahan mein subah shaam hai Tab tak mere naam tu Jab tak jahan mein mera naam hai Tab tak mere naam tu x (2) Uljhan bhi hoon teri Uljhan ka hal bhi hoon main Thoda sa ziddi hoon Thoda paagal bhi hoon main Barkha bijli baadal jhoote Jhooti phoolon ki saughatein Sachchi tu hai sachcha main hoon Sachchi apne dil ki baatein Dastkhat hathon se hathon pe kar de tu Na kar aakhon pe palkon ke parde tu Kya ye itna bada kaam hai, elaan hai Jab tak jahan mein subah shaam hai Tab tak mere naam tu Jab tak jahan mein mera naam hai Tab tak mere naam tu x (2) Mere hi ghere mein ghoomegi harpal tu aise Suraj ke ghere mein rehti hai dharti yeh jaise Payegi tu khud ko na mujhse juda Tu hai mera aadha sa hissa sada Tukde kar chaahe khwaabon ke tu mere Tutenge bhi tu rehne hain woh tere Tujhko bhi to yeh ilhaam hai Elaan hai"
113,Qaafirana,Kedarnath,"Arijit Singh, Nikhita Gandhi",Amit Trivedi,Amitabh Bhattacharya, ,In waadiyon mein takra chuke hain Humse musafir yoon to kayi Dil na lagaya humne kisi se Kise sune yoon to kayi Aise tum mile ho Aise tum mile ho Jaise mil rahi ho itra se hawa Qaafirana sa hai Ishq hai ya kya hai? x (2) Godi mein pahadiyon ki Ujli dopehri ghuzarna Haye haye tere sath mein Achchha lage Dhalti huyi shaam ne bataya hai Ke door manzil pe raat hai Mujhko tasalli hai yeh Ke hone talak raat Hum donon sath hain Sang chal rahe hain Sang chal rahe hain Dhoop ke kinare chaon ki tarah Qaafirana sa hai Ishq hai ya kya hai? Aise tum mile ho Aise tum mile ho Jaise mil rahi ho itra se hawa Qaafirana sa hai Ishq hai ya kya hai?
114,Sweetheart,Kedarnath,Dev Negi,Amit Trivedi,Amitabh Bhattacharya, ,Do nain sitaare Hain chaand sa mukhda Kya kehna uska afreen Daawat mein jaise ho shahi tukda Uske jaisi na koyi nazneen Shaahi joda pehan ke Aayi jo ban-than ke Wohi to meri sweetheart hai Sharmayi si bagal mein Jo baithi hai dulhan ke Wohi to meri sweetheart hai x (2) Kaise main kahun shukriya Uska mujhpe ehsaan hai Nacheezon ki basti mein woh Jo banke aayi mehmaan hai Lagta hai shaadi ghar mein Uske aane se jaise Chal ke aayi hai khushkismati Saari mehfil ki woh jaan bani hai Kya kehna uska afreen Muflis ke dil ka armaan bani hai Uske jaisi na koyi nazneen Shaahi joda pehan ke Aayi jo ban-than ke Wohi to meri sweetheart hai Sharmayi si bagal mein Jo baithi hai dulhan ke Wohi to meri sweetheart hai Wah wah ji Wah wah kya baat hai x (2)
115,Manzoor-e-Khuda,Thugs Of Hindostan,"Shreya Ghoshal, Sunidhi Chauhan, Sukhwinder Singh, Ajay Gogavale",Ajay-Atul,Amitabh Bhattacharya, ,"Ik haath mein chingariyan Ik haath mein saaz hai Hansne ki hai aadat humein Har ghamm pe bhi naaz hain Aaj apne tamaashe pe Mehfil jo karke rahenge fidaa Jab talak na karein Jism se jaan hogi nahi yeh judaa Manzoor-e-Khuda, manzoor-e-Khuda Manzoor-e-Khuda, manzoor-e-Khuda Noor-e-sitaron se roshan hua hai Noor-e-Khuda Azaadi hai gunaah To kubool hai sazaa Ab to hoga wohi Jo hai manzoor-e-Khuda"
116,Suraiyya,-,"Vishal Dadlani, Shreya Ghoshal",Ajay-Atul,Amitabh Bhattacharya, ,"Tu hai sautan name ki Pathshala prem ki Hum angutha chhaap Imtehaan legi kya x (2) Dhadkanon ki chaal pe Is keharwa taal pe Le chuki alaap Uspe taan legi kya Suraiyya jaan legi kya Suraiyya jaan legi kya Suraiyya bas kar, bas kar yaar Suraiyya jaan legi kya Suraiyya jaan, meri jaan Meri jaan legi kya Suraiyya jaan legi kya Haye ghar suraiyya jaan ke Sar jhuka ke aaye ho De chuki hai darsan Ab parsad degi kya x (2) Sabka dil behla chuki Thumriyan bhi gaa chuki Bandh ke ab sath mein Aalap degi kya Suraiyya jaan degi kya Suraiyya jaan degi kya Suraiyya bas kar, bas kar yaar Suraiyya jaan legi kya Suraiyya jaan, meri jaan Meri jaan legi kya Nahi to jaan degi kya Haye meri nazron mein sab ek hain Meri nazron mein sab ek hain Kya general kya sipahiya Sab ke dil mein khushfehmi hai Woh hi hai mera saiyan Haan do pal ki ghustakhi to Hanste hanste deti hai Mohabbat ka darza Suraiyya Arre arre arre Kal ko upar jana hai Jaake munh dikhana hai Thoda to sudhar jaa suraiyya Arre bas bhi kar suraiyya Rab se dar suraiyya Hai dil tera ya patthar suraiyya Saari jaydaad aur mehakame Likh diye inhone tere hakk mai In thagon se, in thagon se, in thagon se Ab tu Hindostan legi kya Suraiyya jaan legi haan"
117,La La La,Baazaar,"Neha Kakkar, Bilal Saeed",Bilal Saeed,Bilal Saeed, ,"Kudiye mainu saari khabar Mere peeche ki ki kardi ae tu, haan tu Yes I’m talking to you Jhoota mainu pyaar dikha ke Matlab poora kardi hai tu, haan tu Yeah! Rakh sohniye jawani nu sambhaal ke Saddi nazar ae tere har chaal te Bhavein ban lai tu tezz Vekhi auna ik phase Jadon beh ke pachhtavegi Gaane mitran di gaavengi La la la, la la la Ni tu mere piche aavegi La la la, la la la Gaane mitran di gaavengi La la la, la la la Kalli beh ke pachhtavegi La la la, la la la Mundeya ni tu paye kadar Tere layi kya kya kardi hoon main, haan main Sabse lad’di hoon main Mere piche duniya saari Par ik tere pe hi marti hoon main, haan main Yeah! Par rakhi na tu koyi khushfehmi Jadon vekhega tu main vich Grammy Phir mere naal khichi photo Apne friend’an ne tu kadd ke vekhavega Gaane mere hi tu laavega La la la, la la la Jadon gaddi tu chalavega La la la, la la la x (2)"
118,Vashmalle,-,"Sukhwinder Singh, Vishal Dadlani",Ajay-Atul,Amitabh Bhattacharya, ,"Raat paune baarah pe Daal ke sharara Baghdad se mangaai raat hai Haal se malangi hai Chaal se firangi Shaitan ki lugayi raat hai Isski adaa mein Kohinoor ka jamaal hai Shaukeen hai mizaaj se miyan kamaal hai Angoor ke nichod mein naha ke aayi hai Mauke ka fayada utha le bemisal hai Ara ra ra Hud-dang mache, shor mache halle Re ara ra ra Jab tak na dhale, raat jashan kar le Haan thirak thirak thirak thirak jhoom le Vashmalle, vashmalle Vashmalle yara vashmalle"
119,Perfect,-,"Badshah, Gurinder",Badshah,Badshah, ,"Yeah! Mr. Rai! It’s your boy! Akhiyan ch soorma tu paya kar na Baal to colour karaya kar na Load ni tainu kisi maskare di Bullan utte lippi laya kar na Ek gall tu dass de mainu Makeup kahton kardi ae Rab ne jehda husn ditta Ohnu cover kyun karke rakhdi ae Ek gall tu dass de mainu Makeup kahton kardi ae Mainu taan ohda hi Tu lage mainu perfect Baby ban gayi tu saddi girl Tu lage mainu perfect Tere wargi no party girl x (2) Perfect jaise Kohli ki timing Perfect jaise flow mera, flow mera Teri har ek cheez hai perfect Perfection mind karti hai blow mera Har outfit teri hit Teri alag hawa, tujhe nahi parwah girl Jaadu kala teri yeh jawani Na kisi se le kuchh karwa girl Kar na tu love, na kar tu ladaiyan Ladkon ki tere pichhe chhooti hai padhaiyan BP ho jaaye low jab cute sa face Bana ke leti tu angdaiyan Jo bhi tujhe chahiye le le go grab it De de mujhe dil apna let me have it Yeh to tujhko bhi hai pata Loonga tujhko pata main kyun Habit! Teri lod ni kudiye mehngi mehngi dress’an di Teri simplycity ne patlon kehar machaya hai Kyun sheeshe moore behke time gawauni ae Jad rabb ne khulla time tere laaya ae Koyi kami labhdi nai Tu jachdi ae saari ni Kal ki karaan rab ton daraan Lakk patla pata ton bhaari ni Koyi kami labhdi nai Tu jachdi ae saari ni Kal ki karaan rab ton daraan Lakk patla.. Tu lage mainu perfect Baby ban gayi tu saddi girl Tu lage mainu perfect Tere wargi no party girl x (4)"
120,Maee Re,Dassehra,"Rekha Bhardwaj, Madhushree",Vijay Verma,Rajesh Manthan, ,Arre maee maee re Arre maee maee re Maee re chhede hain logan Maee re ghoore hain logan Maee re taade hain logan Taana maare hain logan Daiyya bairi bhayi hai yeh angdayi re Bachi tera aanchal dhalke Bachi chal sambhal sambhal ke Bachi yahan majnu dil ke Pahsna nahi inse milke Warna karti phiregi maee maee re Maee re chhede hain logan Maee re ghoore hain logan Solah to gaya hai peechhe Aaya saal satrah Harihar jawani pe chadha hai Bhaari khatra Rasiya hamare rass ke Bhanwre hain saare Phans gayi main to raama Karke ishare Chhankayi kaahe toone dagar mein Sone ki pagdi kaahe baandhi kamar mein Ghar se akeli kaahe nikli gujariya Isiliye lattu tujhpe sabki najariya Machhli kaante mein aake Tab pachhtayi re Arre nahi re chhede hain logan Maee re ghoore hain logan Arre maee maee re
121,Nain Na Jodeen,Badhaai Ho,"Ayushmann Khurrana, Neha Kakkar, Rochak Kohli",Rochak Kohli,Kumaar, ,Sajna haye! Sajna.. Tere bin saans na lein Mere din raat Ho sajna.. Khaali khaali lagte hain Lakeeron wale hath Ho sajna.. Tere bin saans na lein Mere din raat Khaali khaali lagte hain Lakeeron wale hath Sath mere chalte chalte Haye sath mere chalte chalte Raste na modeen Nain na jodeen kitte Nain na jodi Nain na jodeen kitte Nain na jodi Tainu vaasta khuda da haye Tainu vaasta khuda da Mera dil na todeen Birha da rang jis nu lag jaawan Akhiyan vichon barse sawan Lag ke jis di tutt gayi yaari Raah takde reh gaye sajan Jis nu ishq de gham lagde ne haye Jis nu ishq de gham lagde Reh jaandi jindadi thodi Nain na jodeen kitte Nain na jodi Nain na jodeen kitte Nain na jodi Haye nain na jodeen kitte Nain na jodi Nain na jodeen kitte.. Nain na jodi
