,Song,Movie,Singers,Musicians,Lyricists,Year,Lyrics
300,Nachdi Phira,Secret Superstar,Meghna Mishra,Amit Trivedi,Kausar Munir, ,Teri hi boli boloongi main Teri hi baani gaaungi main Tere ishq da chola pehan ke Main tujhme hi rang jaungi Tere ishq da chooda pehan ke Main tujhme hi saj jaungi Mai nachdi phira Ban than baliye ho Main nachdi phira Chham chham chhaliye ho Kehti hai duniya Main hoon banwariya Sudh se gayi main Khud se gayi main Teri ho gayi main Par jag kya jaane Man ke fasane Kho kar khud ko Paa kar tujh ko Meri ho gayi main Teri nagariya jaungi main Teri nazariya varoongi main Tere ishq da chola pehan ke Main tujhme hi rang jaungi Tere ishq da chooda pehan ke Main tujhme hi saj jaungi Mai nachdi phira Ban than baliye ho Main nachdi phira Chham chham chhaliye ho x (2)
301,I’ll Miss You,Secret Superstar,Kushal Chokshi,Amit Trivedi,Kausar Munir, ,"Sadhe saat baje in the morning Paune panch baje in the evening Jab pehli barishein shuru hongi Jab summer holidays khatam honge Khushi mein bhi kabhi Gham mein bhi kabhi Bewajah kabhi I’ll miss you Ho tanne prem karun chhu x (3) Ho tanne prem karun chhu Ghuzroonga jab bhi tere gate se Kar loonga tera zara sa wait main I know tu kabhi bhi nahi aayegi Ho jaunga zara sa late main Chai khariyan in the morning Cold coffeeyan in the evening Jab happy birthday tera hoga Jab happy birthday mera hoga 31st December, 14th Feburary Navratri I’ll miss you Ho tanne prem karun chhu x (3) Ho tanne prem karun chhu I know ke yeh teri majboori hai Lekin badi hi buri yeh doori hai Meri aakhon mein tu dekh ke yeh bata Kya jaana tera itna zaroori hai Don’t go na I will be lonely Don’t go na I will be only Aisa kya bata hai wahan pe Jo nahi mila hai yahan pe Yaar hai yahan pe Pyar hai yahan pe Main bhi hoon yahan pe ho I’ll miss you Ho tanne prem karun chhu x (3) Ho tanne prem karun chhu Ho tanne prem karun chhu Haan tanne prem karun chhu Haan tanne love karun chhu Haan tanne love karun chhu I’ll miss you"
302,Golmaal Title Track,Golmaal Again,"Brijesh Shandilya, Aditi Singh Sharma",S. Thaman,Kumaar, ,"Hello, hi, namaste, salaama Aa gaye phir se karne hungama Boring lamhon ko kar de gulabi Jashn rukne na denge zara bhi Apna famous hai yaarana Apne sang tu bhi aa jaana Chhod duniya se sharmana Zoron zoron se tu chillana Go go golmaal, go go golmaal Everything is gonna be Go go golmaal x (2) Tumko ae yaar ullu bana de Khul ke tu muskura na Chhod fikron ki ghanti bajana Dil ki dholak bajana Seeti hothon pe le aana Mauj masti ho rozana Josh kitna hai dikhlana Zoron zoron se tu chillana Go go golmaal, go go golmaal Everything is gonna be Go go golmaal x (2)"
303,Thoda Aur,Ranchi Diaries,Arijit Singh,Jeet Gannguli,Manoj Muntashir, ,"Chale aao paas mere thoda aur Thoda aur, thoda aur x (2) Zara si baat hai Samajhte kyon nahi Tere bin main nahi Mere bin tu nahi Mere ho jao na suno thoda aur Chale aao paas mere thoda aur Thoda aur, thoda aur x (2) Kahaan yeh yaari thi Tere milne se pehle Main yoon pagal kahaan thi Tere milne se pehle Chaloon main, rukoon main Tere isharon pe Zameen kahaan hoon Main hoon sitaron pe Udne do aaja mujhko thoda aur Thoda aur, thoda aur Chale aao paas mere thoda aur Thoda aur, thoda aur Zara si baat hai Samajhte kyon nahi Tere bin main nahi Mere bin tu nahi Mere ho jao na suno thoda aur Chale aao paas mere thoda aur Thoda aur, thoda aur"
304,Sapne Re,Secret Superstar,Meghna Mishra,Amit Trivedi,Kausar Munir, ,"Chori se, chori se Chhup chhup ke maine Chori se, chori se Chhup chhup ke Tinka tinka chun ke Sapna ek banaya Dori se, dori se Bunn bunn ke maine Dori se, dori se Bunn bunn ke Tukda tukda see ke Sapna ek banaya x (2) Sapne re, sapne re, sapne mere Sach ho jana re, ho jana re Ho jana re x (2) Aaja diary mein chhupa doon Aaja tujhko choti mein bandhun Kahin kisi ko na dikh jaye Sapne re, sapne re, sapne mere Hath tera kass ke pakad loon Sath sath tere main chal don Dar tujhe na kisi se lag jaye Sapne re, sapne re, sapne mere Raaton ko, raaton ko Jag jag ke maine Raaton ko raaton ko Jag jag ke Taara taara chunn ke Sapna ek banaya x (2) Sapne re, sapne re, sapne mere Sach ho jana re, ho jana re Ho jana re x (2) Sapne re, sapne re, sapne mere"
305,Jaana Ve,Aksar 2,Arijit Singh,Mithoon,Sayeed Quadri, ,"Mohabbat, ibadat, shikayat Main jis-se karoon woh tum ho Tumhi ho jaan-e-jaan Ghuzarish ya khwaahish Farmaish main jis-se karoon woh tum ho Tumhi ho sathiya Chehra tera maange aakhein meri o jaana Teri justju mein kat’ta har din mera Jaana ve, jaana ve Mohabbat karte rehna re Ho mausam chaahe kaisa bhi Hamesha mera rehna re x (2) Khayalon mein maine tujhko buna tha Haqeekat mein mujhko tu mil gaya Yehi soch ke main khud hairan hoon Rab ko yeh kaise pata chal gaya Likhi thi mukaddar mein Chaahat teri oh jaana Ke tu jahan mein mera ho hi gaya Jaana ve, jaana ve Mohabbat karte rehna re Ho mausam chaahe kaisa bhi Hamesha mera rehna re x (2) Teri aarzu mein kabse jee raha tha Teri justju thi mujhe bepanah Nigahon se meri tu door na jaana Baahon mein meri ghar hai tera Meri har tamanna hai poori huyi oh jaana Mehka hua hai har lamha mera Jaana ve, jaana ve Mohabbat karte rehna re Ho mausam chaahe kaisa bhi Hamesha mera rehna re x (2) Jaana ve, jaana ve Jaana ve"
306,Aa To Sahi,Judwaa 2,"Neha Kakkar, Meet Bros, Roach Killa",Meet Bros,Sonu Saggu, ,Sun baby teri deadly hai walk ni Tere thumke bhi karte hain talk ni x (3) Ho dil kare vekhi jaoon teri ore Tu nazrein mila to sahi Dil diya hai jaan bhi tujhe denge Dil diya hai jaan bhi tujhe denge Tu ik vaari aa to sahi x (2) Dil diya hai jaan bhi tujhe denge Tu nazrein mila to sahi Tu ik vaari aa to sahi Kab mummy daddy mere tu patayega Leke band baja ghar mere aayega x (2) Kab tak mujhe aise hi ghumayega Tu baat badha to sahi Dil diya hai jaan bhi tujhe doongi Dil diya hai jaan bhi tujhe dongi Tu ik vaari Tu ik vaari aa to sahi Dil diya hai jaan bhi tujhe dungi Tu ik vaari aa to sahi Dil diya hai jaan bhi tujhe dungi Tu nazrein mila to sahi Tu ik vaari aa to sahi Ho baby I just wanna tell you I’ve got one chance to love you Tu dil mera lutt ke lai gayi Te akhan naal sab kuchh keh gayi x (2) Just wanna live with you Jab maarda tu mujhpe try’an Sharma ke meri palak hai jhukdi Jab pakde tu meriyan kalaiyan Heartbeat badhti te kabhi rukdi x (2) Hua tujhse main kudiye attach ni Teri kundli bhi kar loonga match ni x (2) Tujhe jaldi se wife banaunga Tu mood bana to sahi Dil diya hai jaan bhi tujhe denge Dil diya hai jaan bhi tujhe denge Tu ik vaari aa to sahi x (2) Dil diya hai jaan bhi tujhe denge Tu nazrein mila toh sahi Tu ik vaari aa to sahi Aa to sahi
307,Tere Mere,Chef,Armaan Malik,Amaal Mallik,Rashmi Virag, ,"Tere mere darmiyan hain Baatein ankahi Tu wahan hai, main yahan kyun Sath hum nahi x (2) Faisle jo kiye, faasle hi mile Raahein juda kyun ho gayi Na tu galat, na main sahi Le ja mujhe sath tere Mujhko na rehna sath mere x (2) Le ja mujhe, le ja mujhe Thodi si dooriyan hain Thodi majboriyan hain Lekin hai jaanta mera dil Ek din to aayega jab tu lau aayega Tab phir mukurayega mera dil Sochta hoon yehi baithe baithe yunhi Raahein juda kyun ho gayi Na tu galat, na main sahi Le ja mujhe sath tere Mujhko na rehna sath mere x (2) Le ja mujhe, le ja mujhe Yaadon se ladd raha hoon Khud se jhagad raha hoon Aankhon mein neend hi nahi hai Ho tujhse juda huye to Lagta aisa hai mujhko Duniya meri bikhar gayi hai Dono ka tha safar Manzilon pe aakar Raahein juda kyun ho gayi Na tu galat, na main sahi Le ja mujhe sath tere Mujhko na rehna sath mere x (2) Le ja mujhe, le ja mujhe Sun mere khuda Bas itni si meri dua Lauta de humsafar mera Jayega kuchh nahi tera Tere hi dar pe hoon khada Jaaun to jaaun main kahan Takdeer ko badal meri Mujh pe hoga karam tera"
308,Meri Pyaari Ammi,Secret Superstar,Meghna Mishra,Amit Trivedi,Kausar Munir, ,Thodi si cute hai Thodi si karari bhi Thodi si cool hai Thodi si purani bhi Jaise garmi mein thanda sa Sharbat khatta meetha sa Jaise sardi mein chaahat ka Koyi kambal mota sa Meri pyaari ammi jo hai x (4) Mushkil mein hoti hoon Ammi meri roti hai Khushi mein bhi meri woh Dupatta bhigoti hai Ek ek aansu mein Duayein piroti hain Koyi bataye kya hai Ammi aisi hoti hain Thodi si sayani hai Thodi si emotional Ammi jo hass de to Tal jaaye har mushkil Jaise kismat ki chaabhi hai woh Jo khole kar tala Maine apne sapnon ka Har baksa unko de dala Meri pyaari ammi jo hai x (4)
309,Ankhha Churave,Patel Ki Punjabi Shaadi,"Amitabh Narayan, Sanjivani",Lalit Pandit,Sanjay Chhel, ,Ankhha churave kyun ghadi ghadi ghadi Chhalla ghumave kyun khadi khadi khadi x (2) Oh mere saathiya oh bolo bolo Oh mere beliya Tere ang ang mein hai tarang Teri baat baat mein jal tarang Teri yaad yaad ke sang sang Main jeeta hoon x (2) Ab khol khol tu dil ke dwar Kab tak karoonga tera intezar Ab to laga de naiya ko paar Main dooba hoon Channa deti hai signal Haan hundi ismein koyi gall Mere lonely lonely dil mein Teri only only baatein Kar de jeena haram Teri adaa lagti mujhe bhali bhali Jaise samunder pe shaam dhali dhali Chhalla ghumave kyun khadi khadi khadi Oh mere saathiya oh bolo bolo Oh mere beliya x (2)
310,Oonchi Hai Building 2.0,Judwaa 2,Anu Malik & Neha Kakkar,-,-, ,Oonchi hai building Arre lift teri band hai Kaise mein aaun Arre dil razamand hai Aaha! Aaja aaja aaja Mere sagar wale raja Teri yaad sataye Doolhe raja ab tu aaja Aaja aaja aaja Band baja leke aaja Teri yaad sataye Doolhe raja ab tu aaja Kaise oonchi hai building Ae lift teri band hai Haan kaise mein aaun Arre dil razamand hai Kaise… Tere vaste daud kar aaunga main Hey 100 seedhiyon ko bhi chadh jaunga main Ho tu mera dilbar hai aana padega Tujhe mera nakhra uthana padega Ho utni hai door tu Jitni kareeb hai Haan aankh maarti hai Arre ladki ajeeb hai Ladki ajeeb hai ladki ladki ladki Ladki ladki ajeeb hai Aaja aaja Teri yaad sataye.. Aaja aaja aaja Mere sagar wale raja Teri yaad sataye Doolhe raja ab tu aaja x (2)
311,Aaj Zid,Aksar 2,Arijit Singh,Mithoon,Sayeed Quadri, ,"Aaj zid kar raha hai dil Aaj zid kar raha hai dil Karna hai bas tujhe hasil Aaj zid kar raha hai dil Ho mujhme tu ho bhi ja shamil Aaj zid kar raha hai dil Kahin khud ko mujhme tu Chhod ja, chhod ja Tere sath mujhko tu Jod ja, jod ja Yeh jo kanch ke jaisi Ek deewar hai Meri baahon mein use Tod ja, tod ja Yeh jo ik adhuorapan hai Ik duosre se bhar de Jise umar bhar na bhulein Woh lamhe mil jaayein Maan le mujhe tere kabil Aaj zid kar raha hai dil Ho mujhme tu ho bhi ja shamil Aaj zid kar raha hai dil Bepanah tujhpe fida hoon Bepanah tujhe chaahta hoon Bepanah tujhe maanta hoon Bepanah, bepanah Tu nasha tu khumar Tera junun sar pe sawar Aaj tu khud ko mere yaar De pila, de pila Mujhe sirf teri lagan hai Use mil ke pura kar de Meri itni si hai khwaahish Tera pyar mil jaye Ban bhi ja tu meri manzil Aaj zid kar raha hai dil Ho mujhme tu ho bhi ja shamil Aaj zid kar raha hai dil Hmm aaj zid. Aaj zid kar raha hai dil x (2) Aaj zid.."
312,Shugal Laga Le,Chef,Raghu Dixit,Raghu Dixit,Ankur Tewari, ,"Hey ghoomein awara se mere kadam jahan Banta gaya bas rasta Raahi mile jahan bhi pagle man-mauji jo Badhta gaya bas karwan Meri sunega to agle shanichar ko Paar lagegi naiya Aur jo na lage, chinta saari jhad je Sur mila ke gaate ja Gham bhula ke shugal laga le Rang jama ke shugal laga le Befikar tu shugal lagate jaa Shugal laga le Naach le tu shugal laga le Dum laga ke shugal laga le Befikar tu shugal lagate jaa Shugal laga le aur gaate ja Ae jaane de fikrein Farig hon jigre Jaane de jo beeta Aane de dil mein Ho ja ab jinde Jee le ab yeh lamha Kal jo beeta to usko jaane de Na kar koyi parwah bas udd ja Koyi naachine, koni taali hai Bas iraadon ke par laga ke ja Ja ja udd ja"
313,Tere Bina,Haseena Parkar,"Arijit Singh, Priya Saraiya",Sachin-Jigar,Priya Saraiya, ,Rangon bina jaise ho aasman Khushbu bina jaise behti hawa Jaise bina haya ke parda ho koyi Jaise bina dua ke sajda koyi Tere bina main Tere bina main Ke tere bina main Ho tere bina main Aa tujhko chaahun main toot ke Jana kabhi na rooth ke Ho aa tujhko chaahun main toot ke Jana kabhi na rooth ke Jaise bina rooh ke jism ho koyi Jaise bina wafa ke ishq koyi Tere bina main Tere bina main Ke tere bina main Ho tere bina main Tujhe baandh ke main taveez sa Apna bana loon main khuda Yehi minnatein yehi hai dua Ishq mukammal ho mera Ho yehi minnatein hain meri Aaye na judayi Bezar se jahan jiyunga nahi Tere bina main Tere bina main Ke tere bina main Ho tere bina main
314,Chalti Hai Kya 9 Se 12,Judwaa 2,"Dev Negi, Neha Kakkar","Sandeep Shirodkar, Anu Malik",Dev Negi, ,"Aankh lada ke toone mara Ghayal ho gaya dil bechara Suna hai tere chahne wale Aage 10 hain pichhe 12 Mujhko apna jaan bana le Chamka de kismat ka taara Arre ek baar se dil nahi bharta Mud ke dekh mujhe dobara Tan tana tan tan tan taara Tan tana tan tan tan taara Chalti hai kya 9 se 12 One two three four Arre tan tana tan tan tan taara Tan tana tan tan tan taara Chalti hai kya 9 se 12 Suna hai tere chahne wale Aage 10 hain pichhe 12 Arre khadi khadi kya soch rahi hai Chal ho jayein 9, 2, 11 1 2 3 4 Tan tana tan tan tan taara Tan tana tan tan tan taara Chalti hai kya 9 se 12 Tan tana tan tan tan taara Arre aankh lada ke toone mara Ghayal ho gaya dil bechara Chalti hai kya 9 se 12 Chalti, chalti, chalti, chalti"
315,Lag Ja Gale,Bhoomi,Rahat Fateh Ali Khan,Sachin-Jigar,Priya Saraiya, ,"Rab warga ve, rab warga Mainu hai mila maahi rab warga Zinda hai yeh dil mera Saanson se teri sanam Tere dil mein basa hai mera sara jahan Pehla pyar tu mera Tu hi aakhri sanam Teri chahat maan baith Main hoon khuda Tere mere pyar nu nazar na lage Ruk ja o yaara ya lag ja gale Jaan waliye lag ja gale x (2) Tere mere pyar nu nazar na lage Ruk ja o yaara ya lag ja gale Jaan waliye lag ja gale x (2) Rab warga ve, rab warga Mainu hai mila maahi rab warga x (2)"
316,Main Kaun Hoon,Secret Superstar,Meghna Mishra,Amit Trivedi,Kausar Munir, ,"Koyi yeh bata de main hoon kahan Koyi to bata de mera pata Sahi hai ke nahi meri yeh dagar Loon ke nahi main apna ye safar Dar lagta hain sapnon se Kar de na yeh tabaah Dar lagta hai apnon se De dein na yeh daga Main chand hoon ya daag hoon Main rakh hoon ya aag hun Main boond hoon ya hoon lehar Main hoon sakun ya hun kehar Koyi ye bata de main kaun hoon? Kyun hoon main, kya hoon Main kaun hoon? Yakeen hai ke nahi Khud pe mujhko kya? Hoon ke nahi main Hai farak padta kya? Kiske kandhon pe roun Ho jaaye jo khata Kisko raahon mein dhoondun Kho jaaye jo pata Main chand hoon ya daag hoon Main rakh hoon ya aag hun Main boond hoon ya hoon lehar Main hoon sakun ya hun kehar Hey hey hey hey Main kaun hoon?"
317,Hoshiyar Rehna,Baadshaho,"Neeraj Arya, Kabir Cafe",-,-, ,"Hoshiyar rehna re nagar mein chor aavega Jagrat rehna re nagar mein chor aavega x (2) Ho chor aavega re ek din Ho chor aavega re ek din, kaal aavega Hoshiyar rehna re nagar mein chor aavega Jagrat rehna re nagar mein chor aavega Ho teer, tope, talwar na barchhi Na bandook chalavega x (2) Ho aavat jaat nazar nahi aave Aavat jaat nazar nahi aave Bhitar ghoom ghumayega Hoshiyar rehna re nagar mein chor aavega Jagrat rehna re nagar mein chor aavega Ghar nahi tode, kila nahi phode Na koyi roop dikhavega x (2) Ho is nagri se usse kaam nahi Is nagri se usse kaam nahi Tujhe utha le jayega Hoshiyar rehna re nagar mein chor aavega Jagrat rehna re nagar mein chor aavega Paisa jiske pichhe insan Badi buri tarah bhaag raha hai Kabir saab ne bataya hai Ke ant mein paise ka hone kya wala hai Ho dhan, daulat aur maal khajeena Yahin dhara reh jayega x (2) Bhai bandhu aur kutumb kabila Bhai bandhu aur kutumb kabila Khada dekh reh jayega Hoshiyar rehna re nagar mein chor aavega Jagrat rehna re nagar mein chor aavega Kahe kabir ya mulk virana Koyi nahi yahan apna x (2) Re mutthi baandh ke aaya re bandhe Mutthi baandh ke aaya re bandhe Hath pasare jayega Hoshiyar rehna re nagar mein chor aavega Jagrat rehna re nagar mein chor aavega Chor aavega!"
318,Pinjra Tod Ke,Simran,Sunidhi Chauhan,Sachin Jigar,Priya Saraiya, ,"Sitaron mein sitara jo hai Mere naam ka chamka abhi Zameen pe hai yeh roshni Ya hai aasman bikhra abhi Jannat ke saaye Jannat le aaye hain baahon mein Ab zindagi jee Kismat ki dor yeh jo Baandhi woh kholi jeene chali Main ab zindagi Pinjra tod ke, tod ke udd jaana hai Baahein khol ke, khol ke udd jaana hai Pinjra tod ke, tod ke udd jaana hai Baahein khol ke, khol ke udd jaana hai Pinjra tod ke, tod ke udd jaana hai Baahein khol ke, khol ke udd jaana hai"
319,Trippy Trippy,Bhoomi,"Badshah, Neha Kakkar, Benny Dayal, Brijesh Shandilya",Sachin-Jigar,Priya Saraiya, ,Ho saiyan tera trippy trippy Hikki hikki hikki hikki Hikki hikki saiyan tera trippy trippy Hikki hikki hikki hikki Saiyan ne modi hamri bahiyan Haye main to mar gayi daiya Woh de gaye hamka Hikki hikki hikki hikki x (2) Pagla haye psychedelic saiyan Nache hai ta ta thaiya Nache hai jaise Hippy hippy hippy hippy Thumri jab gaati aur thumke lagati gori Mere hothon se baaje siti siti siti siti Ho saiyan tera trippy trippy x (2) Hikki hikki hikki hikki Ho gun ka shot laage lu Ho ganda thought laage lu Ho baby hot laage lu Now tell me what to do? Ho gun ka shot laage lu Ho ganda thought laage lu Ho lollypop laage lu Now tell me what to do? x (2) Hikki hikki hikki hikki Hikki hikki hikki Saiyan ke liye main to makeup lagati Ho saiyan ke liye main to makeup lagati Pichhle piya se apna breakup karati Par mere psychedelic saiyan Thaame hai meri bahiyan Par na le aata mere ghar pe barati Thumri jab gaati aur thumke lagati gori Mere hothon se baaje siti siti siti siti Ho saiyan tera trippy trippy Hikki hikki hikki hikki x (2) Ho saiyan tera trippy trippy
320,Chulbuli,Babumoshai Bandookbaaz,Papon,Gaurav Dagaonkar,Ghalib Asad Bhopali, ,"Chulbuli chulbuli zindagi Bulbulon mein ghuli zindagi Pehle pehle kitna haan itrayi thi Door door se hi sharmayi thi Dheere dheere paas aake Muskura ke, gunguna ke Ab kahin pe jaake khuli zindagi Chulbuli chulbuli zindagi Bulbulon mein ghuli zindagi Pyar kyun na ho badi haseen hai Iski har adaa mein koyi scene hai Zid pe jab yeh aaye to na puchhiye Maanti kahan yeh naazneen hai Iski in himakaton pe Lut gaye hain raaston pe Jab shararaton pe tuli yeh zindagi Chulbuli chulbuli"
321,Teen Kabootar,Lucknow Central,"Raftaar, Mohit Chauhan, Divya Kumar",Arjunna Harjaie,"Kumaar, Raftaar", ,"Kyon kisi ka wait karein Aao celebrate karein Arre kyon kisi ka wait karein Aao celebrate karein Haule haule beat badhe Hum hain dance dheeth bade Ho nachenge jab gaana koyi Bajega super duper Ek kabootar, do kabootar, teen kabootar Party karne lage hain saare Chhat ke oopar x (2) Do do ghoont gaye andar to Gutar gutar kare dil ke woofer Gutar gutar kare dil ke woofer Ek kabootar, do kabootar, teen kabootar Aari style bhaari Scooter ko samjhe Ferrari Bahane ki poori taiyyari “Samjhi kuchh samajh mein aa rahi hai” Baat solah aane ki Baat kuchh paane ki Baat-cheet kam karke dikhane ki Jayenge top pe pinjre ke peechhe se Khaana nahi khana ab pinjre ke neech se Zero ke beech mein zero hi hai leader Jeetenge hum to bologe humein cheater Jalta khoon hai boht zyada litre Aazadi milegi aur kabootar honge titar Ek kabootar, do kabootar, teen kabootar Party karne lage hain saare Chhat ke oopar x (2) Do do ghoont gaye andar to Gutar gutar kare dil ke woofer Gutar gutar kare dil ke woofer Ek kabootar, do kabootar, teen kabootar"
322,Bandook Meri Laila,A Gentleman,"Raftaar, Jigar Saraiya, Ash King",Sachin-Jigar,Vayu, ,"Haye haye haye Tu aise aaye aaye aaye Meri aakhon mein explode kardi ae Dhayein dhayein dhayein Dil ko udaaye aye aaye Mere khwaabon ko reload kardi ae Oh seene mein toone bullet utaari to Ude jugnu, haan ude jugnu Lai gayi dil ko kudi tu shikari Bana majnu main, bana majnu Bandook meri laila Bandook meri laila Ban meri laila, ban ban meri laila Ban meri laila, ban ban meri laila Ban meri laila, ban ban meri laila Main hoon nishana tera Bandook meri laila Kudi lage tu beretta ki beti Tainu vekheya te khich gayi totti Tere liye kha loon seene mein goli Phir kyun tu mujhko hi goli baby Hate nazar na tere figure se Jaaye ungli yeh seedhe trigger pe Jo nishana tha na jana teri nazron pe Shooter kehne lage sab mujhe dar ke Oh seene mein toone bullet utaari to Ude jugnu, haan ude jugnu Lai gayi dil ko kudi tu shikari Bana majnu main, bana majnu Bandook meri laila Bandook meri laila Ban meri laila, ban ban meri laila Ban meri laila, ban ban meri laila Ban meri laila, ban ban meri laila Main hoon nishana tera Bandook meri laila"
323,Kudiya Shehar Di,Poster Boys,"Daler Mehndi, Neha Kakkar",Tanishk Bagchi,-, ,"Maare akhiyan re koyi Koyi seeti maare Haan maare akhiyan re koyi Koyi seeti maare Aage pichhe mere chhore Phirte hain saare Main hoon patli patang Mera gora chitta rang Meri nagin jaisi chaal Oye hoye ke kudiya shehar diyan x (4) O lakk patla patang Nale gora gora rang Aisi goriyan bhi shehad se Laage nahi kam Chale nagin jaisi chal Ke kudiya shehar diyan Oye hoye ke kudiya shehar diyan x (2) Haan fire lagi hai jigar mein piya Mere liye sabka tadpe jiya Hum to hai raja rani dil ke bade Aakhon ne teri nasha kar diya Ho mujhe dil de de Dil de de, dil de de, dil Aisi zid na karo meri jaan Ke kudiya shehar diyan Oye hoye ke kudiya shehar diyan x (3) Koyi bajariya mein dekha kare Koyi najariya se senka kare Koyi kalayi ko pakde meri Koyi bina baat pichhe pade Ho bina baat ke mujhe tu Maamle mein na ghaseeto Dar dar phirta hoon Kudiyo se main tabhi to Mera sharmeela hai mijaz Ke kudiya shehar diyan Oye hoye ke kudiyan shehar diyan Kab dil mein basa le Kab dil se nikale Dil kar deti behal Ke kudiya shehar diyan Oye hoye ke kudiya shehar diyan x (5)"
324,Junooni,Qaidi Band,"Arijit Singh, Yashita Sharma",Amit Trivedi,"Sidhant Mago, Kausar Munir", ,"Tere manmauji khwabon se Mere dil ko bhi par lag gaye Par lag gaye Dil ho raha hai farar Tere atrangi iraadon se Mere dil pe rang chadh gaye Rang chadh gaye Dil ho raha hai gulal Ab to karni hain rageeniyan Uddni uddi hain unchaiyan Chhoni chhoni hain chingariyan Junooni ho gayi hain man-marziyan Hai junooni, junooni hai junooni Junooni hai junooni, junooni o.. Teri sangat junooni Dil ki harqat junooni Hai junooni junooni o.. Na kal ka zikar ho Na hamein kabhi kal ki fikar ho Na sochein kabhi hum Kahan pe hoga ghar Tere sang jo dagar ho To phir aasmani safar ho Milne bichhadne ka Zara bhi na ho dar Kehni kehni hain kahaniyan Jeeni jeeeni hain jawaniyan Uddni uddi hain unchaiyan Junooni ho gayi hain man-marziyan Hai junooni, junooni hai junooni Junooni hai junooni, junooni o.. Teri aadat junooni Ban gayi chaahat junooni Hai junooni, junooni o.. Humko bhi kar lo giraftar Apni junooni chaahat mein Humko bhi kar lo giraftar mere yaar Humko bhi kar lo giraftar Apni junooni hasrat mein Humko bhi kar lo giraftar mere yaar Humko bhi kar lo giraftar Humko bhi kar lo giraftar Humko bhi kar lo giraftar mere yaar Yeh kahaniyan junooni Yeh unchayan junooni Yeh rangeeniyan junooni Yeh chingariyan junooni Hai junooni, junooni hai junooni Junooni hai junooni, junooni o.."
325,Meer-E-Kaarwan,Lucknow Central,"Amit Mishra, Neeti Mohan",Rochak Kohli,Adheesh Verma, ,"O bandeya, o bandeya x (3) Teri manzilein huyi gumshuda Phir bhi rashta hai tera meharma Oh meer-e-kaarwan Teri raahon mein rawaan Ke mere naseebon mein Ho koyi to dua Oh meer-e-kaarwan Le chal mujhe wahan Yeh raat bane jahan subah Meer-e-kaarwan, o meer-e-kaarwan Haan laage na dil ab laage nahi Mere pairon tale nikli jo zameen Iss basti mein tha mera ghar Usse kiski lagi phir nazar Woh jo sapnon ka tha kafila Aisa jhulsa ke ab hai dhuan Oh meer-e-kaarwan Le chal mujhe wahan Yeh raat bane jahan subah Meer-e-kaarwan Chal akela raahi Chal chal akela raahi Haan bas tera ilahi Haan bas tera ilahi"
326,Ghungta,Babumoshai Bandookbaaz,Neha Kakkar,Gaurav Dagaonkar,Ghalib Asad Bhopali, ,"Abhi to sabki nazar Dekhe bas mera figure x (2) Dil aakhon mein dhadak jaaye re Socho kya haal hoga Kya bawal hoga Jo yeh chehre se sarak Jaaye jaaye jaaye jaaye Haye re haye mera ghungta Haye re haye mera ghungta Hosh churaye mera ghungta Haye re haye mera ghungta Laaj se main mar jaaun re Koyi uthaye mera ghungta Haye re haye mera ghungta Balkha ke.. Balkha ke jaana koyi jurm jaise hua re Padhte hain meri kamar pe Likhe sab ishare Main chhup ke dekhun to Jo ek look doon to Saans sabki atak jaye re Socho kya haal hoga Kya bawal hoga Jo yeh chehre se sarak Jaaye jaaye jaaye jaaye Ghungta! Haye re haye mera ghungta Hosh udaaye mera ghungta Haye re haye mera ghungta HO laaj se main mar jaaun re Koyi uthaye mera ghungta Haye re haye mera ghungta Haye re haye, haye re haye Haye re haye mera ghungta Haye re haye mera ghungta Koyi uthaye mera ghungta Aaye haye, aye haye, aye haye Ghungta… Haye re mera ghungta"
327,Rocket Saiyyan,Shubh Mangal Saavdhan,"Ritu Pathak, Brijesh Shandilya, Tanishk Bagchi","Tanishk Bagchi, Vayu","Tanishk Bagchi, Vayu", ,Honey honey kar saiyyan Moon pe pahunch gaye January ka sochun saiyyan June pe pahunch gaye x (2) Leke chalein saare hisab hamare saiyyan Aisi philosophy janab fawware saiyyan Rocket hamare saiyyan Rocket hamare saiyyan Saiyyan saiyyan saiyyan saiyyan Rocket hamare saiyyan Duniya palat doonga Tu na lena tension Tere hi liye hai meri Suddenly attention Dekho na baby dil ke wire ki length ko Chhukar dekho pyar wale current ko Baatein kare phenke gulab hamare saiyyan Aisi philosophy janab fawware saiyyan Rocket hamare saiyyan Rocket hamare saiyyan Saiyyan saiyyan saiyyan saiyyan Rocket hamare saiyyan Rocket! saiyyan saiyyan Rocket hamare saiyyan Saiyyan saiyyan saiyyan saiyyan Rocket hamare saiyyan x (2)
